{
  "url": "https://example.test/product/sample-product/",
  "environment": "staging",
  "evidence_state": "observed current output",
  "checks": {
    "title": "Sample Product - Example Store",
    "description": "Sample rendered meta description.",
    "canonical": "https://example.test/product/sample-product/",
    "meta_robots": "index, follow",
    "open_graph": "og:title and og:url present",
    "twitter_card": "summary_large_image present",
    "schema_pieces": [
      "WebPage",
      "Breadcrumb",
      "Product",
      "Offer"
    ],
    "http_robots_header": null,
    "sitemap_status": "needs verification",
    "robots_txt_note": "not checked",
    "llms_txt_note": "not checked"
  },
  "risk_level": "medium",
  "qa_required": [
    "fetch sitemap entry",
    "validate Product schema",
    "check live URL after launch"
  ],
  "notes": "Staging evidence only; repeat on live URL."
}
